{
  "format": "axiom-platform-evidence-record-v1", "formatVersion": 1, "subject": "web", "category": "PROFILE", "platformFamily": "WEB", "profileId": "web-reference-v0-1",
  "sourceCommit": "aaaaaaaaaaaaaaaaaaaaaaaaaaaaaaaaaaaaaaaa", "corpusSha256": "cccccccccccccccccccccccccccccccccccccccccccccccccccccccccccccccc", "runnerVersion": "0.1.0", "runtimeVersion": "0.1.0", "reality": "HOSTED", "status": "PASS", "evidenceSha256": "dddddddddddddddddddddddddddddddddddddddddddddddddddddddddddddddd",
  "pgStatuses": [{ "group": "PG-01", "status": "PASS" }], "diagnostics": [], "environment": { "runnerName": "hosted" }
}
